<?xml version="1.0" encoding="UTF-8"?>
<potvrda_o_vakcinaciji xmlns="http://ftn.uns.ac.rs/vakcina/potvrda"
                       xmlns:xsi="http://www.w3.org/2001/XMLSchema-instance"
                       about="http://www.ftn.uns.ac.rs/rdf/potvrda/123"
                       xmlns:pred="http://www.ftn.uns.ac.rs/rdf/potvrda/predicate/"
                       xsi:schemaLocation="http://ftn.uns.ac.rs/vakcina/potvrda ../schemas/potvrda_o_vakcinisanju.xsd">
    <sifra_potvrde>1232131313/12</sifra_potvrde>
    <licni_podaci>
        <ime_prezime>
            <ime xmlns="http://ftn.uns.ac.rs/vakcina/tipovi">Pera</ime>
            <prezime xmlns="http://ftn.uns.ac.rs/vakcina/tipovi">Peric</prezime>
        </ime_prezime>
        <pol>M</pol>
        <JMBG property="pred:jmbg">1231231231234</JMBG>
        <datum_rodjenja>1999-08-08</datum_rodjenja>
    </licni_podaci>
    <informacije_vakcinacije>
        <informacije_o_dozi>
            <naziv_vakcine property="pred:vakcina">Moderna</naziv_vakcine>
            <datum_doze>2021-12-12</datum_doze>
            <broj_serije>123</broj_serije>
            <broj_doze>1</broj_doze>
            <zdravstena_ustanova property="pred:lokacijaVakcinisanja">Novi Sad Promenada</zdravstena_ustanova>
        </informacije_o_dozi>
    </informacije_vakcinacije>
    <datum_izdavanja_potvrde property="pred:datum">2021-12-12</datum_izdavanja_potvrde>
    <zdravstvena_ustanova>Novi Sad Bolnica</zdravstvena_ustanova>
    <qr_kod></qr_kod>
</potvrda_o_vakcinaciji>